{
  "series": "Request for Comments",
  "number": "200",
  "howpublished": "RFC 200",
  "publisher": "RFC Editor",
  "doi": "10.17487/RFC0200",
  "url": "https://www.rfc-editor.org/info/rfc200",
  "title": "RFC list by number",
  "pagetotal": "7",
  "year": "1971",
  "month": "aug",
  "body": "\n\n\n\n\n\nRequest for Comments: 200                                 August 1, 1971\nNIC: 7152                                               (Author unknown)\n\n                           RFC List by Number\n\n1st Author  Title                          Date              NIC   RFC\n\nCrocker     HOST Software                  7 April 1969      4687   1\nDuvall      HOST Software                  9 April 1969      4688   2\nCrocker     Documentation Conventions      9 April 1969      4689   3\nShapiro     Network Timetable              24 March 1969     4690   4\nRulifson    DEL                            2 June 1969       4691   5\nCrocker     Conversation with Bob Kahn     10 April 1969     4692   6\nDeloche     HOST-IMP Interface             May 1969          4693   7\nDeloche     ARPA Network Functional        5 May 1969        4694   8\n            Specifications\nDeloche     HOST Software                  1 May 1969        4695   9\nCrocker     Documentation Conventions      29 July 1969      4696   10\nDeloche     Implementation of the          1 August 1969     4718   11\n            HOST-HOST Software Procedures\n            in GORDO\nWingfield   IMP-HOST Interface Flow        26 August 1969    4697   12\n            Diagrams\nCerf        Referring to NWG/RFC: 11       20 August 1969    4698   13\n            (no RFC by this number ever issued)                     14\nCarr        Network Subsystem for          25 September 1969 4754   15\n            Time-Sharing HOSTS\nCrocker     M.I.T. (address)               27 August 1969    4719   16\nKreznar     Some Questions Re: HOST-IMP    27 August 1969    4699   17\n            Protocol\nCerf        (use of links 1 and 2)         September 1969    4720   18\nKreznar     Two Protocol Suggestions to    7 October 1969    4721   19\n            Reduce Congestion at\n            Swap-Bound Nodes\nCerf        ASCII Format for Network       16 October 1969   4722   20\n            Interchange\nCerf        (report of Network meeting)    17 October 1969   4723   21\nCerf        HOST-HOST Control Message      17 October 1969   4724   22\n            Formats\nGregg       Transmission of Multiple       16 October 1969   4725   23\n            Control Messages\nCrocker     Documentation Conventions      21 November 1969  4726   24\nCrocker     No High Link Numbers           30 October 1969   4727   25\n                   (no RFC by this number ever issued)              26\nCrocker     Documentation Conventions      9 December 1969   4729   27\nEnglish     Time Standards                 13 January 1970   4730   28\nKahn        Note in Response to Bill       19 January 1970   4731   29\n            English's Request for Comments\n\n\n\n                                                                [Page 1]\n\f\nRFC 200                    RFC List by Number                August 1971\n\n\nCrocker     Documentation Conventions      4 February 1970   4732   30\nBobrow      Binary Message Formats in      February 1968     4733   31\n            Computer Network\nVedder      Connecting M.I.T. Computers    31 January 1969   4734   32\n            to the ARPA Computer-to-Computer\nCrocker     New HOST-HOST Protocol         12 February 1970  4735   33\nEnglish     Some Brief Preliminary Notes   26 February 1970  4736   34\n            on ARC Clock\nCrocker     Network Meeting                3 March 1970      4737   35\nCrocker     Protocol Notes                 16 March 1970     4738   36\nCrocker     Network Meeting Epilogue, etc. 20 March 1970     4739   37\nWolfe       Comments on Network Protocol   20 March 1970     4740   38\n            from NWG/RFC 36\nHarslem     Comments on Protocol Re:       25 March 1970     4741   39\nHarslem     More Comments on the           27 March 1970     4742   40\n            Forthcoming Protocol\nMelvin      IMP-IMP Teletype Communication 30 March 1970     4743   41\nAncona      Message Data Types             31 March 1970     4744   42\nNemeth      Proposed Meeting               6 April 1970      4745   43\nShoshani    Comments on NWG/RFC 33 and 36  10 April 1970     4746   44\nPostel      New Protocol is Coming         14 April 1970     4747   45\nMeyer       ARPA Network Protocol Notes    17 April 1970     4748   46\nPostel      BBN's Comments on NWG/RFC 33   20 April 1970     4749   47\nPostel      A Possible Protocol Plateau    21 April 1970     4750   48\nMeyer       Conversations with Steve       25 April 1970     4728   49\n            Crocker (UCLA)\nHarslem     Comments on the Meyer Proposal 30 April 1970     4751   50\nElie        Proposal for the Network       4 May 1970        4752   51\n            Interchange Language\nPostel      Updated Distribution List      1 July 1970       4753   52\nCrocker     An Official Protocol Mechanism 9 June 1970       4755   53\nCrocker     An Official Protocol Proffering18 June 1970      4756   54\nNewkirk     A Prototypical Implementation  19 June 1970      4757   55\n            of the NCP\nBelove      Third Level Protocol           June 1970         4758   56\nKraley      Thoughts and Reflections on    19 June 1970      4759   57\n            NWG/RFC 54\nSkinner     Logical Message Synchronization 26 June 1970     4760   58\nMeyer       Flow Control - Fixed Versus    27 June 1970      4761   59\n            Demand Allocation\nKalin       Simplified NCP Protocol        13 July 1970      4762   60\nWalden      A Note on Interprocess         17 July 1970      4961   61\n            Communication in a Resource Sharing\nWalden      A System For Interprocess      3 August 1970     4962   62\n            Communication in a Resource Sharing\nCerf        Belated Network Meeting Report 31 July 1970      4963   63\nElie        Getting Rid of Marking         (undated)         4964   64\n\n\n\n\n                                                                [Page 2]\n\f\nRFC 200                    RFC List by Number                August 1971\n\n\nWalden      Comments on Host-Host Protocol  29 August 1970   4965   65\n            Document No. 1 (by S. Crocker\nCrocker     3rd Level Ideas and Other Noise 26 August 1970    5409  66\nCrowther    Proposed Change to Host/IMP     (undated)         5410  67\n            Spec to Eliminate Marking\nElie        Comments on Memory Allocation   31 August 1970    5411  68\n            Control Commands (CEASE, ALL, GVB\nBhushan     Distribution List Change for MIT22 September 1970 5412  69\nCrocker     A Note on Padding               15 October 1970   5413  70\nSchipper    Reallocation in Case of Input   25 September 1970 5414  71\n            Error\nBressler    Proposed Moratorium on Changes  28 September 1970 5415  72\n            to Network Protocol\nCrocker     Response to NWG/RFC 67          25 September 1970 5416  73\nWhite       Specification for Network use   16 October 1970   5417  74\n            of the UCSB On-Line System\nCrocker     Network Meeting                 14 October 1970   5418  75\nBouknight   Connection-By Name: User        28 October 1970   5180  76\n            Oriented Protocol\nGrossman    Syntax and Semantics for the    (undated)         5419  76\n            Terminal User Control Language for                      enc\nPostel      Network Meeting Report          (undated)         5604  77\nHarslem     NCP Status Report: UCSB/RAND    November 1970     5199  78\nMeyer       Logger Protocol Error           16 November 1970  5601  79\nHarslem     Protocols and Data Formats      1 December 1970   5608  80\nBouknight   Request for Reference           3 December 1970   5609  81\n            Information\nMeyer       Network Meeting Notes           9 December 1970   5619  82\nAnderson    Language-Machine for Data       18 December 1970  5621  83\n            Reconfiguration\nNorth       List of NWG/RFC's 1-80          23 December 1970  5620  84\nCrocker     Network Working Group Meeting   5 January 1971    5624  85\nCrocker     Proposal for a Network Standard 5 January 1971    5631  86\n            Format for a Data Stream to\nVezza       Topic for Discussion at the     12 January 1970   5632  87\n            Next Network Group Meeting\nBraden      NETRJS--A Third Level Protocol  13 January 1971   5668  88\n            for Remote Job Entry\nMetcalfe    Some Historic Moments in        19 January 1971   5697  89\n            Networking\nBraden      CN as a Network Service Center  25 January 1971   5707  90\nMealy       A Proposed User-User Protocol   27 December 1970  5708  91\n            (no RFC by this number ever issued)                     92\nMcKenzie    Initial Connection Protocol     27 January 1971   5721  93\nHarslem     Some Thoughts on Network        3 February 1971   5725  94\n            Graphics\nCrocker     Distribution of NWG/RFC's       4 February 1971   5731  95\n            Through the NIC\n\n\n\n                                                                [Page 3]\n\f\nRFC 200                    RFC List by Number                August 1971\n\n\nWatson      AN Interactive Network          12 February 1971  5739  99\n            Experiment to Study Modes of\n            Access to the\nMelvin      A First Cut at a Proposed       15 February 1971  5740  97\n            Telnet Protocol\nMeyer       Logger Protocol Proposal        11 February 1971  5744  98\nKarp        Network Meeting                 22 February 1971  5758  99\nKarp        Categorization and Guide to     26 February 1971  5761  100\n            NWG/RFCs\nWatson      Notes on the Network Working    23 February 1971  5762  101\n            Group Meeting (Urbana, Illinois\nCrocker     Output of the Host/Host Protocol 22-23 February   5763  102\n            Glitch Cleaning Committee             1971\nKalin       Implementation of Interrupt Keys 24 February 1971 5764  103\nPostel      Link 191                        25 February 1971  5768  104\nWhite       Network Specifications for      22 March 1971     5775  105\n            remote Job Entry and Remote Job\nO'Sullivan  User/Server Site Protocol       3 March 1971      5776  106\nBressler    Output of the Host-Host Protocol 23 March 1971    5806  107\n            Glitch Cleaning Committee\nWatson      Attendance List at the Urbana   25 March 1971     5807  108\n            NWG Meeting, February 17-19,\n            1971\nWinett      Level III Server Protocol for   24 March 1971     5808  109\n            the Lincoln Laboratory 360/67\n            Host\nWinett      Convention for Using an IBM 2741 25 March 1971    5809  110\n            terminal as a User Console for\nCrocker     Pressure from the Chairman       31 March 1971    5814  111\nO'Sullivan  User/Server Site Protocol        1 April 1971     5816  112\n            Network Host Questionnaire\nHarslem     Network Activity Report,         5 April 1971     5820  113\n            UCSB--RAND\nBhushan     A File Transfer Protocol         16 April 1971    5823  114\nWatson      Some Network Information Center  16 April 1971    5822  115\n            Policies for Handling\n            Documentation\nCrocker     Structure of the May NWG Mtg.    12 April 1971    5825  116\nWong        Some Comments on the Official    7 April 1971     5826  117\n            Protocol\nWatson      Recommendations for Facility     16 April 1971    5830  118\n            Documentation\nKrilanovich Network Fortran Subprograms      16 April 1971    5831  119\nKrilanovich Network PL1 Subprograms          16 April 1971    5832  120\nKrilanovich Network On-Line Operators        16 April 1971    5833  121\nWhite       Network Specifications for       26 April 1971    5834  122\n            UCSB's Simple-Minded File System\nCrocker     A Proffered Official ICP         20 April 1971    5837  123\n\n\n\n                                                                [Page 4]\n\f\nRFC 200                    RFC List by Number                August 1971\n\n\nMelvin      Typographical Error in RFC 107   19 April 1971    5840  124\nMcConnell   Response to RFC 86, Proposal for 18 April 1971    5841  125\n            Network Standard Format for a\nMcConnell   Ames Graphics Facilities at Ames 18 April 1971    5842  126\n            Research Center\nPostel      Comments on RFC 123              20 April 1971    5843  127\nPostel      Bytes                            21 April 1971    5844  128\nHarslem     A Request for Comments on Socket 22 April 1971    5845  129\n            Name Structure\nHeafner     Response to RFC 111              22 April 1971    5848  130\n            (Pressure from the Chairman)\nHarslem     Response to RFC 116              22 April 1971    5849  131\n            (May NWG Meeting)\nWhite       Typographical Error in RFC 107   28 April 1971    6708  132\nSundberg    File Transfer and Recovery       27 April 1971    6710  133\nVezza       Network Graphics Meeting         29 April 1971    6711  134\nHathaway    Response to NWG/RFC 110          29 April 1971    6712  135\nKahn        Host Accounting and              29 April 1971    6713  136\n            Administrative Procedures\nO'Sullivan  TELNET Protocol --               30 April 1971    6714  137\n            A Proposed Document\nO'Sullivan  TELNET Protocol --               8 May 1971       6783  137\n            A Proposed Document (rev.)                              rev\nAnderson    Status Report on Proposed Data   28 April 1971    6715  138\n            Reconfiguration Service\nO'Sullivan  Discussion on TELNET Protocol    7 May 1971       6717  139\nCrocker     Agenda for the May NWG Meeting   4 May 1971       6725  140\nHarslem     Comments on RFC 114 (A File      29 April 1971    6726  141\n            Transfer Protocol)\nKline       Time-out Mechanism in Host-Host  3 May 1971       6727  142\n            Protocol\nNaylor      Regarding Proffered Official ICP 3 May 1971       6728  143\nShoshani    Data Sharing on Computer Networks30 April 1971    6729  144\nPostel      Initial Connection Protocol      4 May 1971       6739  145\n            Control Commands\nKarp        Views on Issues Relevant to Data 12 May 1971      6742  146\n            Sharing on Computer Networks\nWinett      The Definition of a Socket       7 May 1971       6750  147\nBhushan     Comments on RFC 123              7 May 1971       6751  148\nCrocker     The Best Laid Plans . . .        10 May 1971      6752  149\nKalin       The Use of IPC Facilities --     5 May 1971       6754  150\n            A Working Paper\nShoshani    Comments on a Proffered Official 10 May 1971      6755  151\n            ICP (RFCs 123, 127)\nWilber      SRI Artificial Intelligence      10 May 1971      6756  152\n            Status Report\nMelvin      SRI ARC-NIC Status               15 May 1971      6758  153\nCrocker     Exposition Style                 12 May 1971      6759  154\n\n\n\n                                                                [Page 5]\n\f\nRFC 200                    RFC List by Number                August 1971\n\n\nNorth       ARPA Network Mailing Lists       May 1971         5760  155\nBouknight   Status of the Illinois Site      26 April 1971    6761  156\n            (Response to RFC 116)\nCerf        Invitation to the Second         12 May 1971      6762  157\n            Symposium on Problems in the Optimization\nO'Sullivan  TELNET Protocol --               19 May 1971      6768  158\n            A Proposed Document\n            (no RFC by this number ever issued)                     159\nNIC         RFC Brief List --                18 May 1971      6771  160\n            Title or Partial Title\nShoshani    A Solution to the Race           19 May 1971      6772  161\n            Condition in ICP\nKampe       NETBUGGER3                       22 May 1971      6774  162\nCerf        Data Transfer Protocols          19 May 1971      6775  163\nHeafner     Minutes of the Network Group     25 May 1971      6778  164\n            Meeting, 5/16 through 5/19/71\nPostel      A Preferred Official Initial     25 May 1971      6779  165\n            Connection Protocol\nAnderson    Data Reconfiguration Service --  25 May 1971      6780  166\n            An Implementation Specification\nBhushan     Socket Conventions Reconsidered  24 May 1971      6784  167\nNIC         ARPA Network Mailing Lists       26 May 1971      6785  168\nCrocker     Computer Networks --             27 May 1971      6789  169\n            IEEE Computer Society Workshop\nNIC         RFC List by Number               1 June 1971      6790  170\nBhushan,others  The Data Transfer Protocol   23 June 1971     6793  171\nBhushan,others  The File Transfer Protocol   23 June 1971     6794  172\nKarp        Network Data Management Comittee 4 June 1971      6795  173\n            Meeting Announcement\nPostel      UCLA-Computer Science Graphics   8 June 1971      6799  174\n            Overview\nHarslem     Comments on the \"Socket          11 June 1971     7074  175\n            Conventions Reconsidered\"\nBhushan     Comments on Byte Size for        14 June 1971     7100  176\n            Connections\nMcConnell   A Device Independent Graphical   15 June 1971     7102  177\n            Display Description\nCotton      Network Graphic Attention        27 June 1971     7118  178\n            Handling\nMcKenzie    Link Number Assignments          25 June 1971     7119  179\nMcKenzie    File System Questionnaire        25 June 1971     7123  180\nMcConnell   Modifications to RFC 177         27 June 1971     7124  181\nNorth       Compilation of List of Relevant  25 June 1971     7126  182\n            Site Reports\nWinett      The EBCDIC Codes and Their       16 July 1971     7127  183\n            Mapping to ASCII\nKelley      Proposed Graphic Display Modes   6 July 1971      7128  184\nNorth       NIC Distribution of Manuals and  9 July 1971      7129  185\n\n\n\n                                                                [Page 6]\n\f\nRFC 200                    RFC List by Number                August 1971\n\n\n            Handbooks\nBisot       A Network Graphics Loader        12 July 1971     7130  186\nMcKay       A Network/440 Protocol Concept   July 1971        7131  187\nKarp        Data Management Meeting          25 July 1971     7132  188\n            Announcement\nBraden      Interim NETRJS Specifications    15 July 1971     7133  189\nDeutsch     DEC PDP-10 -- IMLAC Communication 13 July 1971    7135  190\n            System\nIrby        Graphics Implementation and      13 July 1971     7136  191\n            Conceptualization at ARC\nWatson      Some Factors Which A Network     12 July 1971     7136  192\n            Graphic Protocol Must Consider\nHarslem     Network Checkout                 14 July 1971     7136  193\nCerf        Data Reconfiguration Service --  12 July 1971     7139  194\n            Compiler/Interpreter\n            Implementation\nMealy       Data Computers -- Data           16 July 1971     7140  195\n            Descriptions and Access Language\nWatson      A Mail BOX Protocol              20 July 1971     7141  196\nShoshani    Initial Connection Protocol --   14 July 1971     7142  197\n            Reviewed\nHeafner     Site Certification --            21 July 1971     7149  198\n            Lincoln Labs 360/37\nWilliams    Suggestions for Network Data     July 1971        7151  199\n            Tablet\nNIC         RFC List by Number               1 August 1971    7152  200\n\n\n\n       [ This RFC was put into machine readable form for entry ]\n       [ into the online RFC archives by Misrad Todorovac 3/98 ]\n\n\n\n\n\n\n\n\n\n\n\n\n\n\n\n\n\n\n\n\n                                                                [Page 7]\n\f\n"
}