{
  "series": "Request for Comments",
  "number": "384",
  "howpublished": "RFC 384",
  "publisher": "RFC Editor",
  "doi": "10.17487/RFC0384",
  "url": "https://www.rfc-editor.org/info/rfc384",
  "title": "Official site idents for organizations in the ARPA Network",
  "pagetotal": "4",
  "year": "1972",
  "month": "aug",
  "body": "\n\n\n\n\n\nNetwork Working Group                                    Jeanne B. North\nRequest for Comments: 384                ARPA Network Information Center\nObsoletes: 289                                            28 August 1972\nNIC: 11356\n\n\n       OFFICIAL SITE IDENTS FOR ORGANIZATIONS IN THE ARPA NETWORK\n\n   Idents are given here in two lists, a list in alpha order and a list\n   by Site address.\n\n   These lists include only those organizations with present or\n   scheduled direct connection to the Network.  Scheduled Sites are\n   indicated by \"s\".  Inactive addresses are shown as \"i\".\n\nSITE IDENTS IN ALPHA ORDER\n\nSite Ident            Address           Organization\n\nABERDEEN                29 s  Aberdeen Research and Development Center\nAFETR                    - s  Air Force Eastern Test Range\nAFGWC see GWC\nALOHA                   35 i  Aloha Network, University of Hawaii\nALOHA-TIP              163 s  Aloha Network, University of Hawaii\nAMEC      see Belvoir\nAMES-67                 16    NASA Ames Research Center\nAMES-ILLIAC see ILLIAC\nAMES-TIP               144    NASA Ames Research Center\nARPA-TIP               156    Advanced Research Projects Agency\nBBN 1D                 197    Bolt Beranek and Newman Inc.\nBBN-NCC                  5    Bolt Beranek and Newman Inc.\nBBN-TENEXA              69    Bolt Beranek and Newman Inc.\nBBN-TENEXB             133    Bolt Beranek and Newman Inc.\nBBN-TESTIP             158    Bolt Beranek and Newman Inc.\nBBN-TIP                 30 i  Bolt Beranek and Newman Inc.\nBELVOIR                 27 s  USAMERDC, Fort Belvoir\nBELVOIR                 55    USAMERDC, Fort Belvoir\nBURR  see ILLIAC\nCASE-10                 13    Case Western Reserve University\nCCA                     31 s  Computer Corporation of America\nCCA-TIP                159 s  Computer Corporation of America\nCMU-CC                  14    Carnegie-Mellon University\nDCAO                     - s  Defense Communications Agency Operations\nDOCB                   153    Department of Commerce, Boulder\nETAC-TIP               148    USAF-ETAC\nFNWC                    33 s  Fleet Numerical Weather Central\nFNWC-TIP               161 s  Fleet Numerical Weather Central\n\n\n\n\nNorth                                                           [Page 1]\n\f\nRFC 384             SITE IDENTS FOR THE ARPA NETWORK         August 1972\n\n\nSite Ident            Address           Organization\n\nGWC                     24 i  Air Force Global Weather Central\nGWC-TIP                152    Air Force Global Weather Central\nHARV-1                  73    Harvard University\nHARV-10                  9    Harvard University\nHARV-11                137    Harvard University\nICCC                   161 s  Intl. Computer Commun. Conference\nILL-ANTS                12    University of Illinois\nILLIAC                  15    NASA Ames Research Center\nLBL                     34 s  Lawrence Berkeley Labs\nLLL                      - s  Lawrence Livermore Labs\nLL-67                   10    M.I.T. Lincoln Laboratory\nLL-TSP                 138    M.I.T. Lincoln Laboratory\nLL-TX-2                 74    M.I.T. Lincoln Laboratory\nMCCL-418                22    McClellan Air Force Base\nMIT-AI                 134    M.I.T., Artificial Intelligence Group\nMIT-DMCG                70    M.I.T., Dynamic Modeling and Control Group\nMIT-ML                 198    M.I.T., Mathematics Laboratory\nMIT-MULTICS             6     M.I.T., MULTICS Group\nMITRE-TIP              145    MITRE Corporation\nNBS-CCST                19    National Bureau of Standards\nNBS-TIP                147    National Bureau of Standards\nNCAR-TIP see DOCB\nNYU                     -  s  New York University\nPARC-MAXC               32 s  XEROX PARC\nPARC-VTS                96 s  XEROX PARC\nRADC-645                18 i  Rome Air Development Center\nRADC-TIP               146    Rome Air Development Center\nRAND-RCC                 7    Rand Corporation\nSAAC-TIP               154    Teledyne Geotech,\n                              Seismic Analysis Array Center\nSDC-ADEPT                8    System Development Corporation\nSRI-AI                  66    Stanford Research Institute,\n                              Artificial Intelligence Group\nSRI-ARC                  2    Stanford Research Institute,\n                              Augmentation Research Center\nSU-AI                   11    Stanford University,\n                              Artificial Intelligence Group\nTINK-418                21    Tinker Air Force Base\nUCLA-NMC                 1    University of California at Los Angeles,\n                              Network Measurement Center\nUCLA-CCN                65    University of California at Los Angeles\n                              Campus Computing Network\nUCSB-MOD75               3    University of California at Santa Barbara\nUCSD-CC                129    University of California at San Diego\nUSC-44                  23 s  University of Southern California\n\n\n\n\nNorth                                                           [Page 2]\n\f\nRFC 384             SITE IDENTS FOR THE ARPA NETWORK         August 1972\n\n\nUSC-ISI                 71    University of Southern California\n                              Information Sciences Institute\nUSC-TIP                151    University of Southern California\nUTAH-10                  4    University of Utah\n\n\nSITE IDENTS IN NUMBER ORDER\n\nSite Ident           Address           Organization\n\nAFETR                    - s   Air Force Eastern Test Range\nLLL                      - s   Lawrence Livermore Labs\nNYU                      - s   New York University\nUCLA-NMC                 1     University of California at Los Angeles,\n                               Network Measurement Center\nSRI-ARC                  2     Stanford Research Institute\n                               Augmentation Research Center\nUCSB-MOD75               3     University of California at Santa Barbara\nUTAH-10                  4     University of Utah\nBBN-NCC                  5     Bolt Beranek and Newman Inc.\nMIT-MULTICS              6     M.I.T., Multics Group\nRAND-RCC                 7     Rand Corporation\nSDC-ADEPT                8     System Development Corporation\nHARV-10                  9     Harvard University\nLL-67                   10     M.I.T. Lincoln Laboratory\nSU-AI                   11     Stanford University,\n                               Artificial Intelligence Group\nILL-ANTS                12     University of Illinois\nCASE-10                 13     Case Western Reserve University\nCMU-CC                  14     Carnegie-Mellon University\nILLIAC                  15     NASA Ames Research Center\nAMES-67                 16     NASA Ames Research Center\nMITRE                   17 i   MITRE Corporation\nRADC-645                18 i   Rome Air Development Center\nNBS-CCST                19     National Bureau of Standards\nETAC                    20 i   USAF-ETAC\nTINK-418                21     Tinker Air Force Base\nMCCL-418                22     McClellan Air Force Base\nUSC-44                  23 s   University of Southern California\nGWC                     24 i   Air Force Global Weather Central\nNOAA                    25 i   Department of Commerce, Boulder\nSAAC                    26 i   Teledyne Geotech,\n                               Seismic Analysis Array Center\nAMEC                    27 s   USAMERDC, Fort Belvoir\nARPA                    28     Advanced Research Projects Agency\nABERDEEN                29 s   Aberdeen Research and Development Center\nBBN-TIP                 30 i   Bolt Beranek and Newman Inc.\nCCA                     31 s   Computer Corporation of America\n\n\n\nNorth                                                           [Page 3]\n\f\nRFC 384             SITE IDENTS FOR THE ARPA NETWORK         August 1972\n\n\nSite Ident           Address           Organization\n\nPARC-MAXC               32 s   Xerox Parc\nFNWC                    33 i   Fleet Numerical Weather Central\nLBL                     34 s   Lawrence Berkeley Labs\nALOHA                   35 i   Aloha Network, University of Hawaii\nUCLA-CCN                65     University of California at Los Angeles,\n                               Campus Computing Network\nSRI-AI                  66     Stanford Research Institute,\n                               Artificial Intelligence Group\nBBN-TENEXA              69     Bolt Beranek and Newman Inc.\nMIT-DMCG                70     M.I.T. Dynamic Modeling and Control Group\nUSC-ISI                 71     University of Southern California,\n                               Information Sciences Institute\nHARV-1                  73     Harvard University\nLL-TX-2                 74     M.I.T. Lincoln Laboratory\nAMES                    79 i   NASA Ames Research Laboratory\nPARC-VTS                96     Xerox PARC\nUCSD-CC                129     University of California at San Diego\nBBN-TENEXB             133     Bolt Beranek and Newman Inc.\nMIT-AI                 134     M.I.T., Artificial Intelligence Group\nHARV-11                137     Harvard University\nLL-TSP                 138     M.I.T. Lincoln Laboratory\nAMES-TIP               144     NASA Ames Research Center\nMITRE-TIP              145     MITRE Corporation\nRADC-TIP               146     Rome Air Development Center\nNBS-TIP                147     National Bureau of Standards\nETAC-TIP               148     USAF-ETAC\nUSC-TIP                151     University of Southern California\nGWC-TIP                152     Air Force Global Weather Central\nDOCB                   153     Department of Commerce, Boulder\nSAAC-TIP               154     Teledyne Geotech\n                               Seismic Analysis Array Center\nBELVOIR                155     USAMERDC, Fort Belvoir\nARPA-TIP               156     Advanced Research Projects Agency\nBBN-TESTIP             158     Bolt Beranek and Newman Inc.\nCCA-TIP                159 s   Computer Corporation of America\nICCC                   161 s   Intl. Comp. Comm. Conference\nFNWC                   161 s   Fleet Numerical Weather Central\nALOHA-TIP              163 s   Aloha Network, University of Hawaii\nBBN-1D                 197     Bolt Beranek and Newman Inc.\nMIT-ML                 198     M.I.T., Mathematics Laboratory\n\n\n\n        [This RFC was put into machine readable form for entry]\n    [into the online RFC archives by Helene Morin, Via Genie 12/99]\n\n\n\n\nNorth                                                           [Page 4]\n\f\n"
}