{
  "series": "Request for Comments",
  "number": "300",
  "howpublished": "RFC 300",
  "publisher": "RFC Editor",
  "doi": "10.17487/RFC0300",
  "url": "https://www.rfc-editor.org/info/rfc300",
  "title": "ARPA Network mailing lists",
  "pagetotal": "9",
  "year": "1972",
  "month": "jan",
  "body": "\n\n\n\n\n\nNetwork Working Group\nRequest for Comments: 300                                25 January 1972\nObsoletes: RFC 211  NIC 7191\nNIC 8468\n\n\n                       ARPA NETWORK MAILING LISTS\n\n   The following are three lists to be used for distribution of Network\n   documents.  List A should be used by sites when they distribute their\n   own documents, to get RFC's to Liaisons as quickly as possible.  All\n   but local mail should be sent Air Mail.  Lists B and C will be used\n   by NIC in making distribution of copies to non-site Network\n   participants and to Station Agents.\n\n   For phone numbers and lists of names by sites see the Current\n   Directory of Network Participants.\n\n   (A)                    A.  INITIAL DISTRIBUTION LIST\n\n   Note: This list includes all Network Liaisons and others who should\n   receive initial distribution of RFC's, whether sent from NIC or from\n   sites. They will also receive selected catalogs and other formal\n   documents from NIC.\n\n   AMES-CD                             CMU\n\n   A. Wayne Hathaway                   Harold R. Van Zoeren\n   Mail Stop 233-9                     Carnegie-Mellon University\n   NASA Ames Research Center           Computer Science Department\n   Moffett Field, Calif. 94035         Schenley Park\n                                       Pittsburgh, Pa.  15213\n   AMES-ILLIAC\n   John W. McConnell                   DOCB\n   NASA Ames research Center\n   Mail Stop 202-10                    Schuyler Stevenson R-523\n   Moffett Field, Calif. 94035         Department of Commerce NOAA\n                                       325 South Broadway\n   ARPA                                Boulder, Colorado 80302\n\n   Steve D. Crocker                    HARV\n   Advanced Research Project Agency\n   1400 Wilson Boulevard               Robert L. Sundberg\n   Arlington, Virginia  22209          Harvard University\n                                       Aiken Computation Laboratory\n                                       33 Oxford Street\n                                       Cambridge, Mass.  02138\n\n\n\n\n                                                                [Page 1]\n\f\nRFC 300               ARPA NETWORK MAILING LISTS            January 1972\n\n\n   BBN-NET                             IBMW\n\n   Alex McKenzie                       Douglas McKay\n   Bolt Beranek and Newman Inc.        IBM Watson Research Center\n   50 Moulton Street                   P.O. Box  218\n   Cambridge, Mass.  02138             Yorktown Heights, New York  10598\n\n   BBN-TENEX                           ILL\n   Robert H. Thomas                    Karl C. Kelley\n   Belt Beranek and Newman Inc.        University of Illinois\n   50 Moulton Street                   Center for Advanced Computation\n   Cambridge, Mass.  02138             Urbana, Illinois 61801\n\n   CASE                                LINC-67\n\n   Dr. Patrick W. Foulk                Joel M. Winett\n   Jennings Computing Center           Massachusetts Institute of\n   Room 306, Crawford Hall             Technology\n   Case Western Reserve University     Lincoln Laboratory\n   10900 Euclid Avenue                 244 Wood Street\n   Cleveland, Ohio  44106              Lexington, Mass.  02173\n\n   CCA                                 LINC-TX2\n\n   Richard A. Winter                   William Kantrowitz\n   Computer Corporation of America     Massachusetts Institute of\n   565 Technology Square               Technology\n   Cambridge, Mass.  02139             Lincoln Laboratory\n                                       244 Wood Street\n   MIT-DMCG                            Lexington, Mass.  02173\n\n   Abhay Bhushan                       SRI-ARC\n   Project MAC  Room 206\n   545 Technology Square               John T. Melvin\n   Cambridge, Mass.  02139             Stanford Research Institute\n                                       Augmentation Research Center\n                                       Menlo Park, Calif.  94025\n   MIT-MULTICS\n                                       Jeanne B. North  (for NIC)\n   see MIT-DMCG                        Stanford Research Institute\n                                       Augmentation Research Center\n                                       333 Ravenswood Avenue\n                                       Menlo Park, Calif. 94025\n\n\n\n\n\n\n\n\n                                                                [Page 2]\n\f\nRFC 300               ARPA NETWORK MAILING LISTS            January 1972\n\n\n   MITRE                               SU-AI\n\n   Peggy M. Karp                       James A. (Andy) Moorer\n   MITRE Corporation                   Stanford University\n   Information Systems Dept., W140     Computation Center, AI Project\n   Westgate Research Park              Stanford, Calif.  94305\n   McLean, VA  22101\n\n   NBS                                 SU-HP\n\n   Thomas N. Pyke, Jr.                 Edward A. Feigenbaum\n   National Bureau of Standards        Stanford University\n   Center for Computer Sciences and    Heuristic Programming\n   Technology                          Serra House\n   Washington, D.C. 20234              Stanford, Calif.  94305\n\n   NIC                                 UCLA-CCN\n\n   see SRI-ARC                         Robert T. Braden\n                                       University of California at\n   RADC                                Los Angeles\n                                       5308 Math Sciences Building\n   Thomas S. Lawrence                  Los Angeles, Calif.  90024\n   Rome Air Development Center (ISIM)\n   Griffiss Air Force Base\n   Rome, New York  13440\n\n   RAND                                UCLA-NMC\n\n   John F. Heafner                     Ari O. Ollikainen\n   Rand Corporation                    University of California at\n   Computer Science Department         Los Angeles\n   1700 Main Street                    Computer Science Department\n   Santa Monica, Calif.  90406         3732 Boelter Hall\n                                       Los Angeles, Calif.  90024\n\n   RAY                                 UCSB\n\n   Thomas O'Sullivan                   James E. White\n   Raytheon Data Systems               University of California at\n   1415 Boston-Providence Turnpike     Santa Barbara\n   Norwood, Mass.  02062               Computer Research Laboratory\n                                       Santa Barbara, Calif.  90024\n\n\n\n\n\n\n\n\n                                                                [Page 3]\n\f\nRFC 300               ARPA NETWORK MAILING LISTS            January 1972\n\n\n   SDC                                 UCSD-CC\n\n   Abe S. Landsberg                    Charles Holland\n   System Development Corporation      Computer Center\n   2500 Colorado Avenue                University of California at\n   Santa Monica, Calif.  90406         San Diego\n                                       La Jolla, Calif. 90037\n\n   SRI-AI                              USAF-ETAC\n\n   B. Michael Wilber                   Capt. George N. Petregal\n   Stanford Research Institute         USAF-ETAC\n   Artificial Intelligence Group       Bldg. 159\n   333 Ravenswood Avenue               Navy Yard Annex\n   Menlo Park, Calif.  94025           Washington, D.C. 20333\n\n   USC\n\n   James Pepin\n   University of Southern California\n   School of Engineering\n   Los Angeles, Calif.  90007\n\n   UTAH\n\n   Barry D. Wessler\n   University of Utah\n   Computer Science/IRL\n   Salt Lake City, Utah  84112\n\n\n\n\n\n\n\n\n\n\n\n\n\n\n\n\n\n\n\n\n\n\n                                                                [Page 4]\n\f\nRFC 300               ARPA NETWORK MAILING LISTS            January 1972\n\n\n   (B)                   B. LIST FOR DISTRIBUTION FROM NIC\n\n\n   Note: These Network participants will receive all formal Network\n   documents sent from NIC, in the mailing to Liaisons when such is\n   made, otherwise at the time documents are sent to Station Agents.\n\n   CCCTF                               WATERU\n\n   C. D. Shepard                       Prof. Donald Cowan\n   Canadian Computer Communications    Dept. of Computer Science\n   Task Force                          University of Waterloo\n   100 Metcalfe Street                 Waterloo, Ontario, Canada\n   4th Floor\n   Ottawa 2, Canada\n\n   DART                                CHIU\n\n   Prof. Robert F. Hargraves           Prof. Robert L. Ashenhurst\n   Kiewit Computation Center           Institute for Computer Research\n   Dartmouth University                University of Chicago\n   Hanover, New Hampshire  03755       Chicago, Illinois  60637\n\n   EDUCOM                              NPL\n\n   John LeGates                        Derek Barber\n   EDUCOM                              Computer Science Division\n   44 School Street                    National Physical Laboratory\n   Boston, Mass.  02108                Teddington, Middlesex, England\n\n   MERIT                               UBC\n\n   E. M. Aupperle                      Dave Tywer\n   MERIT Computer Network              Computing Center\n   University of Michigan              University of British Columbia\n   1037 N. University Building         Vancouver 8, Canada\n   Ann Arbor, Michigan  48104\n\n   NETH                                NSF\n\n   Tjaart Schipper                     Dr. D. D. Aufenkamp\n   13 Marijkestraat                    Office of Computing Activities\n   Leiderdorp, Netherlands             National Science Foundation\n                                       1800 G Street, N.W.\n                                       Washington, D. C. 20550\n\n\n\n\n\n\n                                                                [Page 5]\n\f\nRFC 300               ARPA NETWORK MAILING LISTS            January 1972\n\n\n   SUNY\n\n   Prof. Art J. Bernstein\n   SUNY Stoneybrook\n   Dept. of Computer Science\n   Stoneybrook, L.I., N.Y.  11790\n\n\n   UCI\n\n   Prof. David Farber\n   Dept. of Information and Computer Science\n   University of California\n   Irvine, Calif.  92664\n\n   UKICS\n\n   Prof. Peter Kirstein\n   Institute of Computer Science\n   University of London\n   44 Gordon Square\n   London, W.C.1, England\n\n   WASHU\n\n   Marianne Pepper\n   Washington University\n   Computer Systems Laboratory\n   724 South Euclid Avenue\n   St. Louis, No.  63110\n\n\n\n\n\n\n\n\n\n\n\n\n\n\n\n\n\n\n\n\n\n                                                                [Page 6]\n\f\nRFC 300               ARPA NETWORK MAILING LISTS            January 1972\n\n\n   (C)                   C.  NIC STATION AGENTS\n\n   Note: Station Agents receive copies from NIC of all documents\n   distributed to Liaisons, as well as documents sent as part of a\n   Station collection.  A mailing is made to Station Agents once a week,\n   or oftener when quantity warrants.\n\n   AMES-CD                             DOCB\n\n   See AMES-ILLIAC                     Dorothy A. Reynolds P-522\n                                       Department of Commerce NOAA\n   AMES-ILLIAC                         325 South Broadway\n                                       Boulder, Colorado 80302\n   Stan Golding\n   Mail Stop 233-13                    ILL\n   NASA Ames Research Center\n   Moffett Field, Calif.  94035        Marcia Trager\n                                       University of Illinois\n   ARPA                                Center for Advanced Computation\n                                       168 Engineering Research\n   Pam J. Klotz                        Laboratory\n   Advanced Research Projects Agency   Urbana, Ill.  61801\n   1400 Wilson Boulevard\n   Arlington, Va.  22209\n\n   BBN-NET                             LINC-67\n\n   see BBN-TENEX                       Carol J. Mostrom\n                                       Massachusetts Institute of\n                                       Technology\n   BBN-TENEX                           Lincoln Laboratory\n                                       244 Wood Street\n   Steve G. Chipman                    Lexington, Mass.  02173\n   Bolt Beranek and Newman Inc.\n   50 Moulton Street                   LINC-TX2\n   Cambridge, Mass.  02138\n                                       see LINC-6\n\n   CASE                                MIT-DMCG\n\n   John Barden                         Frances Y. Knight\n   Case Western Reserve University     Project MAC\n   Computing and Information Sciences  545 Technology Square\n   10900 Euclid Ave.                   Cambridge, Mass.  02139\n   Cleveland, Ohio  44106\n                                       MIT-MULTICS\n\n                                       see MIT-DMCG\n\n\n\n                                                                [Page 7]\n\f\nRFC 300               ARPA NETWORK MAILING LISTS            January 1972\n\n\n   CCA                                 MITRE\n\n   Martha A. Ginsberg                  Ernest H. Forman\n   Computer Corporation of America     MITRE Corporation\n   565 Technology Square               Information Systems Dept.,\n   Cambridge, Mass.  02139             W150\n                                       Westgate Research Park\n   CMU                                 McLean, Va.  22101\n\n   Nancy R. Teater                     NBS\n   Carnegie-Mellon University\n   Computer Science Department         Mrs. Shirley W. Watkins\n   Schenley Park                       National Bureau of Standards\n   Pittsburgh, Pa.  15213              Bldg. 225, Room B216\n                                       Washington, D.C. 20234\n\n   HARV                                NIC\n\n   Bradley A. Reassow                  see SRI-ARC\n   Harvard University\n   Aiken Computation Laboratory        UCLA-[NMC]\n   33 Oxford Street\n   Cambridge, Mass.  02138             Anita Coley\n                                       University of California at\n   RADC                                Los Angeles\n                                       Computer Science Department\n   Marcelle D. Petell                  3732 Boelter Hall\n   Rome Air Development Center (ISIM)  Los Angeles, Calif.  90024\n   Griffiss Air Force Base\n   Rome, New York  13440\n\n   RAND                                 UCSB\n\n   Linda M. Connelly                    Connie Rosewall\n   Rand Corporation                     University of California at\n   Computer Science Department          Santa Barbara\n   1700 Main Street                     Computer Research Laboratory\n   Santa Monica, Calif.  90406          Santa Barbara, Calif.  93106\n\n   RAY                                  UCSD-CC\n\n   Laura White                          Charles Hollano\n   Raytheon Data Systems                Computer Center\n   1415 Boston-Providence Turnpike      University of California at\n   Norwood, Mass.  02062                San Diego\n                                        La Jolla, Calif.  90037\n\n\n\n\n\n                                                                [Page 8]\n\f\nRFC 300               ARPA NETWORK MAILING LISTS            January 1972\n\n\n   SDC                                  USAF-ETAC\n\n   Janet W. Troxel                      M/Sgt. Glen Grazier\n   System Development Corporation       USAF-ETAC\n   Information Processing Information   Bldg. 159\n   Center                               Navy Yard Annex\n   2500 Colorado Avenue                 Washington, D. C. 20333\n   Santa Monica, Calif.  90406\n\n   SRI-AI                               USC\n\n   Rilla J. Reynolds                    Linda M. Webster\n   Stanford Research Institute          University of Southern California\n   Artificial Intelligence Group        Olin Hall of Engineering\n   333 Ravenswood Ave.                  Los Angeles, Calif.  90007\n   Menlo Park, Calif.  94025\n\n   SRI-ARC                              UTAH\n\n   Cindy Page                           Gennie L. Cederholm\n   Stanford Research Institute          University of Utah\n   Augmentation Research Center         3154 Merrill Engineering Bldg.\n   333 Ravenswood Ave.                  Salt Lake City, Utah  84112\n   Menlo Park, Calif.  94025\n\n   SU-AI                                SU-HP\n\n   Barbara A. Barnett                   Carol Wilkinson\n   Stanford University                  Stanford University\n   Artificial Intelligence Project      Heuristic Programming Project\n   D.C. Power Lab                       Serra House\n   Stanford, Calif.  94305              Stanford, Calif.  94305\n\n   UCLA-CCN\n\n   Imogen C. Beattie\n   University of California at Los Angeles\n   3531 Boelter Hall\n   Los Angeles, Calif.  90024\n\n\n         [ This RFC was put into machine readable form for entry ]\n        [ into the online RFC archives by Mirsad Todorovac 11/98 ]\n\n\n\n\n\n\n\n\n                                                                [Page 9]\n\f\n"
}