{
  "series": "Request for Comments",
  "number": "211",
  "howpublished": "RFC 211",
  "publisher": "RFC Editor",
  "doi": "10.17487/RFC0211",
  "url": "https://www.rfc-editor.org/info/rfc211",
  "title": "ARPA Network Mailing Lists",
  "pagetotal": "13",
  "year": "1971",
  "month": "aug",
  "body": "\n\n\n\n\n\nNetwork Working Group                                         J.B. North\nRequest for Comments: 211                    Stanford Research Institute\nObsoletes: RFC 168 NIC 6785                                  August 1971\nNIC: 7191\n\n\n                       ARPA Network Mailing Lists\n\n   The following are three lists to be used for distribution of Network\n   documents. List A should be used by sites when they distribute their\n   own documents, to get RFC's to Liaisons as quickly as possible.  All\n   but local mail should be sent Air Mail.  Lists B and C will be used\n   by NIC in making distribution of copies to non-site Network\n   Participants and to Station Agents.\n\n   A distribution list for the Network Graphics Group has been sent to\n   members of that Group, and will included in the forthcoming Directory\n   of Network Participants.\n\n   For phone numbers and lists of name by sites, see the Current\n   Directory of Network Participants.\n\nA.  Initial Distribution List\n\n   Note: this list includes all Network Liaisons and others who should\n   receive initial distribution of RFC's, whether sent from NIC or from\n   sites.  They will also receive selected catalogs and other formal\n   documents from NIC.\n\n   Ames-CD\n\n      A. Wayne Hathaway\n      Mail Stop 233-9\n      NASA Ames Research Center\n      Moffett Field, Calif. 94035\n\n   AMES-ILLIAC\n\n      John W. McConnell\n      NASA Ames Research Center\n      Mail Stop 237-9\n      Moffett Field, Calif. 94035\n\n\n\n\n\n\n\n\n\nNorth                                                           [Page 1]\n\f\nRFC 211                ARPA Network Mailing Lists            August 1971\n\n\n   ARPA\n\n      Steve D. Crocker\n      Advanced Research Projects Agency\n      1400 Wilson Boulevard\n      Arlington, Virginia 22209\n\n   BBN-NET\n\n      Alex McKenzi\n      Bold Beranek and Newman Inc.\n      50 Moulton Street\n      Cambridge, Mass. 02138\n\n   BBN-TENEX\n\n      Robert H. Thomas\n      Bold Beranek and Newman Inc.\n      50 Moulton Street\n      Cambridge, Mass. 02138\n\n   CASE\n\n      Dr. Patrick W. Foulk\n      Jennings Computing Center\n      Room 306, Crawford Hall\n      Case Western Reserve Laboratory\n      10900 Euclid Avenue\n      Cleveland, Ohio 44106\n\n   CCA\n\n      Richard A. Winter\n      Computer Corporation of America\n      565 Technology Square\n      Cambridge, Mass. 02139\n\n   CMU\n\n      Harold R. Van Zoeren\n      Carnegie-Mellon University\n      Computer Science Department\n      Schenley Park\n      Pittsburgh, Pa. 15213\n\n\n\n\n\n\n\nNorth                                                           [Page 2]\n\f\nRFC 211                ARPA Network Mailing Lists            August 1971\n\n\n   HARV\n\n      Robert L. Sundberg\n      Harvard University\n      Aiken Computation Laboratory\n      33 Oxford Street\n      Cambridge, Mass. 02138\n\n   IMBW\n\n      Douglas McKay\n      IBM Watson Research Center\n      P.O. Box 218\n      Yorktown Heights, NY 10598\n\n   ILL\n\n      James M. Madden\n      University of Illinois\n      Center for Advanced Computation\n      168 Engineering Research Laboratory\n      Urbana, Illinois 61801\n\n   LINC-67\n\n      Joel M. Winett\n      Massachusetts Institute of Technology\n      Lincoln Laboratory\n      244 Wood Street\n      Lexington, Mass. 02173\n\n   LINC-TX2\n\n      William Kantrowitz\n      Massachusetts Institute of Technology\n      Lincoln Laboratory\n      244 Wood Street\n      Lexington, Mass. 02173\n\n   MIT-DMCG\n\n      Aphay Bhushan\n      Project MAC\n      545 Technology Square\n      Cambridge, Mass. 02139\n\n\n\n\n\n\nNorth                                                           [Page 3]\n\f\nRFC 211                ARPA Network Mailing Lists            August 1971\n\n\n   MIT-MULTICS\n\n      See MIT-DMCG\n\n   MITRE\n\n      Peggy M. Karp\n      MITRE Cooperation\n      Information Systems Dept., W140\n      Westgate Research Park\n      McLean, Va. 22101\n\n   NBS\n\n      Thomas N. Pyke, Jr.\n      National Bureau of Standards\n      Center for Computer Sciences and Technology\n      Washington,  D.C., 20234\n\n   NIC\n\n      See SRI-ARC\n\n   RADC\n\n      Thomas Lawrence\n      Rome Air Development Center (ISIM)\n      Griffiss Air Force Base\n      Rome, New York 13440\n\n   RAND\n\n      John F. Heafner\n      Rand Corporation\n      Computer Science Department\n      1700 Main Street\n      Santa Monica, CA 90406\n\n   RAY\n\n      Thomas O'Sullivan\n      Raytheon Data Systems\n      1415 Boston-Providence Turnpike\n      Norwood, Mass. 02062\n\n\n\n\n\n\n\nNorth                                                           [Page 4]\n\f\nRFC 211                ARPA Network Mailing Lists            August 1971\n\n\n   SDC\n\n      Abe S. Landsberg\n      System Development Corporation\n      2500 Colorado Avenue\n      Santa Monica, Calif. 90406\n\n   SRI\n\n      B. Michael Wilber\n      Stanford Research Institute\n      Artificial Research Institute\n      333 Ravenswood Avenue\n      Menlo Park, Calif. 94205\n\n   SRI-ARC\n\n      John T. Melvin\n      Stanford Research Institute\n      Augmentation Research Center\n      333 Ravenswood Avenue\n      Menlo Park, Calif. 94025\n\n      Jeanne B. North (for NIC)\n      Stanford Research Institute\n      Augmentation Research Center\n      333 Ravenswood Avenue\n      Menlo Park, Calif. 94025\n\n   SU-AI\n\n      James A. [Andy] Moorer\n      Stanford University\n      Computation Center, AI Project\n      Stanford, Calif. 94305\n\n   SU-HP\n\n      Edward A. Feigenbaum\n      Stanford University\n      Heuristic Programming\n      Serra House\n      Stanford, Calif. 94305\n\n\n\n\n\n\n\n\nNorth                                                           [Page 5]\n\f\nRFC 211                ARPA Network Mailing Lists            August 1971\n\n\n   UCLA-CCN\n\n      Robert T. Braden\n      University of California at Los Angeles\n      5308 Math Sciences Building\n      Los Angeles, CA 90024\n\n   UCLA-NMC\n\n      Ari O. Ollikalen\n      University of California at Los Angeles\n      Computer Science Department\n      3732 Boelter Hall\n      Los Angeles, Calif. 90024\n\n   UCSB\n\n      James E. White\n      University of California at Santa Barbara\n      Computer Research Laboratory\n      Santa Barbara, Calif. 93106\n\n   USC\n\n      James Perin\n      University of Southern California\n      School of Engineering\n      Los Angeles, Calif. 90007\n\n   UTAH\n\n      Barry D. Wessler\n      University of Utah\n      Computer Science/IRL\n      Salt Lake City, Utah 84112\n\nB.  List for Distribution from NIC\n\n   Note: These Network participants will receive all formal Network\n   documents sent from NIC, in the mailing to Liaisons when such is\n   made, otherwise at the time documents are sent to Station Agents.\n\n\n\n\n\n\n\n\n\n\nNorth                                                           [Page 6]\n\f\nRFC 211                ARPA Network Mailing Lists            August 1971\n\n\n   CCCTF\n\n      C.D. Shepard\n      Canadian Computer Communications Task Force\n      100 Metcalfe Street\n      4th Floor\n      Ottawa 2, Canada\n\n   DART\n\n      Prof. Robert F. Hargraves\n      Klewit Computation Center\n      Dartmouth University\n      Hanover, New Hampshire 03755\n\n   EDUCOM\n\n      John LeGates\n      EDUCOM\n      100 Charles River Plaza\n      Boston, Mass. 02114\n\n   MERIT\n\n      E.M. Aupperle\n      MERIT Computer Network\n      The University of Michigan\n      1037 N. University Building\n      Ann Arbor, Michigan 48104\n\n   NETH\n\n      Tjaart Schipper\n      13 Marijkestreat\n      Lederdrorp, Netherlands\n\n   SUNY\n\n      Prof. Art J. Bernstein\n      SUNY Stoneybrook\n      Dept. of Computer Science\n      Stoneybrook, L.I., N.Y. 11790\n\n\n\n\n\n\n\n\n\nNorth                                                           [Page 7]\n\f\nRFC 211                ARPA Network Mailing Lists            August 1971\n\n\n   UCI\n\n      Prof. David Farber\n      Dept. of Information and Computer Science\n      University of California\n      Irvine, Calif. 92664\n\n   UKICS\n\n      Prof. Peter Kirstein\n      Institute of Computer Science\n      University of London\n      44 Gordon Square\n      London, W.C.I. England\n\n   WASHU\n\n      Marianne Pepper\n      Washington University\n      Computer Systems Laboratory\n      724 South Euclid Avenue\n      St. Louis, Mo. 63110\n\n   WATERU\n\n      Prof. Donald Cowan\n      Dept. of Computer Science\n      University of Waterloo\n      Waterloo, Ontario, Canada\n\nC.  NIC Station Agents\n\n   Note: Station Agents receive copies from NIC of all documents\n   distributed to Liaisons, as well as documents sent as part of a\n   Station collection.  A mailing is made to Station Agents once a week,\n   or oftener when quantity warrants.\n\n   AMES-CD\n\n      See AMES-ILLIAC\n\n   AMES-ILLIAC\n\n      Stan Golding\n      Mail Stop 233-13\n      NASA Ames Research Center\n      Moffett Field, Calif. 94035\n\n\n\n\nNorth                                                           [Page 8]\n\f\nRFC 211                ARPA Network Mailing Lists            August 1971\n\n\n   ARPA\n\n      Margaret M. Opering\n      Advanced Research Projects Agency\n      1400 Wilson Boulevard\n      Arlington, Va. 22209\n\n   BBN-NET\n\n      See BBN-TENEX\n\n   BBN-TENEX\n\n      Steve G. Chipman\n      Bolt Beranek and Newman Inc.\n      50 Moulton Street\n      Cambridge, Mass. 02138\n\n   CASE\n\n      John Barden\n      Case Western Reserve University\n      Computing and Information Sciences\n      10900 Euclid Ave.\n      Cleveland, Ohio 44106\n\n   CCA\n\n      Martha A. Ginsberg\n      Computer Corporation of America\n      565 Technology Square\n      Cambridge, Mass. 02139\n\n   CMU\n\n      Carolyn M. Lisle\n      Carnegie-Mellon University\n      Computer Science Department\n      Schenley Park\n      Pittsburgh, Pa. 15213\n\n   HARV\n\n      Bradley A. Reussow\n      Harvard University\n      Aiken Computation Laboratory\n      33 Oxford Street\n      Cambridge, Mass. 02138\n\n\n\nNorth                                                           [Page 9]\n\f\nRFC 211                ARPA Network Mailing Lists            August 1971\n\n\n   IBMW\n\n      Douglas McKay\n      IBM Watson Research Center\n      P.O. Box 218\n      Yorktown Heights, N.Y. 10598\n\n   ILL\n\n      Nan Brown\n      University of Illinois\n      Center for Advanced Computation\n      168 Engineering Research Laboratory\n      Urbana, Ill. 61801\n\n   LINC-67\n\n      Carol J. Mostrom\n      Massachusetts Institute of Technology\n      Lincoln Laboratory\n      244 Wood Street\n      Lexington, Mass. 02173\n\n   LINC-TX2\n\n      see LINC-67\n\n   MIT-DMCG\n\n      Frances L. Knight\n      Project MAC\n      545 Technology Square\n      Cambridge, Mass. 02173\n\n   MIT-MULTICS\n\n      see MIT-DMCG\n\n   MITRE\n\n      Madge B. Cornell\n      MITRE Corporation\n      Information Systems Dept., W150\n      Westgate Research Park\n      McLean, Va. 22101\n\n\n\n\n\n\nNorth                                                          [Page 10]\n\f\nRFC 211                ARPA Network Mailing Lists            August 1971\n\n\n   NBS\n\n      Mrs. Shirley W. Watkins\n      National Bureau of Standards\n      Bldg. 225, Room B216\n      Washington, D.C. 20234\n\n   NIC\n\n      see SRI-ARC\n\n   RADC\n\n      Marcella D. Petell\n      Rome Air Development Center (ISIM)\n      Griffiss Air Force Base\n      Rome, New York 13440\n\n   RAND\n\n      Linda M. Connelly\n      Rand Corporation\n      Computer Science Department\n      1700 Main Street\n      Santa Monica, Calif. 90406\n\n   RAY\n\n      Laura White\n      Raytheon Data Systems\n      1415 Boston-Providence\n      Norwood, Mass. 02062\n\n   SDC\n\n      Janet W. Troxel\n      System Development Corporation\n      Information Processing Information Center\n      2500 Colorado Avenue\n      Santa Monica, Calif. 90406\n\n   SRI-AI\n\n      Rilla J. Reynolds\n      Stanford Research Institute\n      Artificial Intelligence Group\n      333 Ravenswood Avenue\n      Menlo Park, Calif. 94205\n\n\n\nNorth                                                          [Page 11]\n\f\nRFC 211                ARPA Network Mailing Lists            August 1971\n\n\n   SRI-ARC\n\n      Cindy Page\n      Stanford Research Institute\n      Augmentation Research Center\n      333 Ravenswood Ave.\n      Menlo Park, Calif. 94205\n\n   SU-AI\n\n      Barbara A. Barnett\n      Stanford University\n      Artificial Intelligence Project\n      D.C. Power Lab\n      Stanford, Calif. 94305\n\n   SU-HP\n\n      Carol Wilkinson\n      Stanford University\n      Heuristic Programming Project\n      Serra House\n      Stanford, Calif. 94305\n\n   UCLA-CCN\n\n      Imogen C. Beattie\n      University of California at Los Angeles\n      2531 Boelter Hall\n      Los Angeles, Calif. 90024\n\n   UCLA-NMC\n\n      Anita Coley\n      University of California at Los Angeles\n      Computer Science Department\n      3732 Boelter Hall\n      Los Angeles, Calif. 90024\n\n   UCSB\n\n      Connie Rosewall\n      University of California at Santa Barbara\n      Computer Research Laboratory\n      Santa Barbara, Calif. 93106\n\n\n\n\n\n\nNorth                                                          [Page 12]\n\f\nRFC 211                ARPA Network Mailing Lists            August 1971\n\n\n   USC\n\n      Linda M. Webster\n      University of Southern California\n      Olin Hall of Engineering\n      Room 240\n      Los Angeles, Calif. 90007\n\n   UTAH\n\n      Nancy F. Bruderer\n      University of Utah\n      Computer Science/IWL\n      Salt Lake City, Utah 84112\n\n\n\n\n\n\n\n\n\n\n\n\n\n\n\n\n\n\n\n\n\n\n\n\n\n\n\n\n\n\n\n\n\n\n\n\n\nNorth                                                          [Page 13]\n\f\n"
}