{
  "series": "Request for Comments",
  "number": "243",
  "howpublished": "RFC 243",
  "publisher": "RFC Editor",
  "doi": "10.17487/RFC0243",
  "url": "https://www.rfc-editor.org/info/rfc243",
  "title": "Network and data sharing bibliography",
  "pagetotal": "7",
  "year": "1971",
  "month": "oct",
  "body": "\n\n\n\n\n\nRequest for Comments: 243                               Alvin P. Mullery\nCategory: T                             Thomas J. Watson Research Center\nNIC: 7673                                         Yorktown Heights, N.Y.\n                                                         October 5, 1971\n\n\n                 NETWORK AND DATA SHARING BIBLIOGRAPHY\n\n\n   GENERAL DATA STRUCTURES\n\n   F. D. Anzelno, \"A Data-Storage Format for Information System Files,\"\n   IEEE Trans. Computers, vol. c-20, pp. 39-43, January 1971.\n\n   E. F. Codd, \"A Relational Model of Data for Large Shared Data Banks,\"\n   Comm. ACM, vol 13, pp. 377-387, June 1970.\n\n   C. T. Davies, \"A Logical Concept for the Control and Management of\n   Data\",  AR-0803-00.\n\n   S. E. Madnick and J. W. Alsop II, \"A Modular Approach to File System\n   Design,\" 1969 Spring Joint Computer Conf., AFIPS Proc., vol 34, pp.\n   1-13, 1969.\n\n   W. C. McGee, \"File Structures for Generalized Data Management,\" Proc.\n   IFIPS Congress 68, pp. 1233, 1968.\n\n   P. D. Rovner and J. A. Feldman, \"The IEAP Language and Data\n   Structure,\" Proc IFIPS Congress 68, pp. 579, 1968.\n\n\n   DATA DESCRIPTION\n\n   T. H. Bonn, \"A Standard for Computer Networks,\"Computer, vol. 4, p.\n   10-14, May/June, 1971.\n\n   \"Data Base Task Group Report,\" CODASYL Program Language Committee.\n\n   \"IBM Data Base Task Group Representative Minority Report,\" CODASYL\n   Program Language Committee, Oct. 17, 1969.\n\n   M. Donaldson, S. Robinovitz, and B. Wolfe, \"Proposed MICIS Standard\n   for Data Description,\" Michigan Interuniversity Committee on\n   Information Systems, Dec. 4, 1970.\n\n\n\n\n\n\n\nMullery                                                         [Page 1]\n\f\nRFC 243          Network and Data Sharing Bibliography      October 1971\n\n\n   M. Ellis and K. Nelson, \"A Data Description Language for Hierarchical\n   Data Files,\" Data and Computation Center for the Social Sciences at\n   The University of Wisconsin, Social Science Building, Madison,\n   Wisconsin, November 1970.\n\n   D. Evans and A. Van Dam, \"Data Structure Programming Language,\" Proc.\n   IFIP Congress 68, pp. 557-564, 1968.\n\n   G. A. Gibson, \"Draft:  Data Description Language,\" fdt (a publication\n   of the ACM Special Interest Committee on File Description and\n   Translation), vol. 1, p. 9-13, 10 August 1969.\n\n   L. V. Haibt and A. P. Mullery, \"Data Descriptive Language for Shared\n   Data,\" IBM Research Report RC3476, August 1971.\n\n   A. W. Holt, \"Information System Theory Project,\" Applied Data\n   Research, Princeton, Rept. ADR-RFF-6606, Sept. 1968.\n\n   G. J. Lipovshy, \"The Architecture of Large Distributed Logic\n   Associative Memory,\" Univ. of Illinois, Urbana, Rept. R-424, July\n   1969 (contains a discussion of representation structures suitable for\n   describing complex data bases).\n\n   C. N. Mooers, \"A Standard Method for the Description of External Data\n   Formats,\" part IV of \"Standards for User Procedures and Data Formats\n   in Automatic Information Systems and Networks,\" Zator, Co., Cambridge\n   Mass., Aug. 28, 1967.\n\n   C. N. Mooers, \"Data Descriptive Languages,\" fdt (a publication of the\n   ACM Special Interest Committee on File Description and Translation),\n   vol. 1, p. 31-36, 10 August 1969.\n\n   H. R. Morse, \"Efficiency and the Use of Data Definition Techniques,\"\n   fdt (a publication of the ACM Special Interest Committee on File\n   Description and Translation), vol. 1, p. 20-23, 10 August 1969.\n\n   M. Schaefer, \"User's Guide for DRL:  General Description,\" System\n   Development Corporation, Santa Monica, Calif., Rept. TM-3870/001/01,\n   September, 1969.\n\n   D. P. Smith, \"A Data Description Facility,\" Pennsylvania Univ., AD-\n   703244, April 1970.\n\n   T. A. Standish, \"A Data Definition Facility for Programming\n   Languages,\" Carnegie Institute of Technology, AD-658042, May 18,\n   1967. B. Wegbreit, \"The Treatment of Data Types in EL1\" Technical\n   Report, Division of Engineering and Applied Physics, Harvard Univ.,\n   May 1971.\n\n\n\nMullery                                                         [Page 2]\n\f\nRFC 243          Network and Data Sharing Bibliography      October 1971\n\n\n   B. Wegbreit, \"The Treatment of Data Types in EL1\" Technical Report,\n   Division of Engineering and Applied Physics, Harvard Univ., May 1971.\n\n\n   DATA CONVERSION\n\n   R. Anderson, E. Harslem, and J. Heafner, \"Language-Machine for Data\n   Reconfiguration,\" ARPA Network Working Group, Request for Comments\n   no. 83, Rept. NIC 5621, 18 December 1970.\n\n   K. Sattley, R. F. Millstein, S. Marshall, \"On Program\n   Transferability,\" Applied Data Research, Inc., Rept. RADC-TR-70-217,\n   Nov. 1970.\n\n   M. Schaefer, \"DBL - A Language for Converting Data Bases,\"\n   Datamation, vol. 16, pp. 123, June 1970.\n\n\n   DATA MANAGEMENT\n\n   W. W. Chu, \"Optimal File Allocation in a Multiple Computer System,\"\n   IEEE Trans. Computers, vol. C-18, pp. 885-889, October 1969.\n\n   P. G. Hebalkar, \"A Graph Model for Analysis of Deadlock Prevention in\n   Systems with Parallel Computations,\" IBM Research Report RC3367,\n   April 22, 1971.\n\n   N. B. W. Lampson, \"A Scheduling Philosophy for Multi-Processing\n   Systems,\" Comm. ACM, vol. 11, p. 347-360, May, 1968.\n\n   P. J. Owens, \"Phase II, A Data Management System Model,\" IBM Research\n   Rept. RJ665, Jan. 29, 1970.\n\n   M. E. Senko, V. Y. Lum, P. J. Owens, \"A File Organization Evaluation\n   Model (FOREM),\" Proc IFIP Congress 68, August, 1968.\n\n   A. Shoshani and A. J. Bernstein, \"Synchronization in a Parallel-\n   Accessed Data Base,\" Comm. ACM, vol 12, pp. 604-607, Nov. 1969.  V.\n   K. M. Whitney, \"A Study of Optimal File Assignment and Communication\n   Network Configuration in Remote-Access Computer Message Processing\n   and Communication Systems,\" SEL Technical Report No. 48, System\n   Engineering Lab, Dept. of Elect. Engin., University of Michigan,\n   September, 1970.\n\n\n\n\n\n\n\n\nMullery                                                         [Page 3]\n\f\nRFC 243          Network and Data Sharing Bibliography      October 1971\n\n\n   DATA SECURITY\n\n   P. Baran, \"On Distributed Communication:  IX. Security, Secrecy, and\n   Tamper-Free Considerations,\" The RAND Corporation, AD-444839, August\n   1964.\n\n\n   DATA TRANSMISSION\n\n   \"Proposed Character Set for Roman Alphabet and Romanized Non-Roman\n   Alphabets\" American Standards Institute Document X3.2/836, May 29,\n   1969.\n\n   \"Final Report of the Electronic Industries Association Committee on\n   Netting Computer System,\" Marc Bendick, Chairman, System Dev. Corp.\n   Rept. SP-3514, May, 1970.\n\n   K. A. Bartlett, \"Transmission Control in a Local Data Network,\" Proc.\n   IFIP Congress 68, p. 704-708.  August 1968.\n\n   K. A. Bartlett, \"Transmission Control in a Local Data Network,\" Proc.\n   IFIP Congress 68, p. 704-708.  August 1968.\n\n   S. Carr, S. Crocker, V. Cerf, \"Host-Host Communication Protocol in\n   the ARPA Network,\" 1970 Spring Joint Computer Conf., AFIPS Proc., vol\n   36, pp. 589-598, 1970.\n\n   D. W. Davies, \"Communication Networks to Serve Rapid-response\n   Computers,\"  Proc IFIP Congress 68, p. 650-656, August 1968.\n\n   D. W. Davies, \"The Principles of a Data Communication Network for\n   Computers and Remote Peripherals,\" Proc IFIP Congress 68, p. 709-714,\n   August 1968.\n\n   \"Computer Netting, Standardization, and Systems Management,\" Computer\n   Netting Committee, Defense Communication Council, Electronic\n   Industries Association, I. Bialick, Chairman, 15 September 1969.\n\n   H. Frank, \"Analysis and Optimization of Store-and Forward Computer\n   Networks,\" Network Analysis Corporation, AD-707438, June 15, 1970.\n\n   M. E. Jacobs, \"Standard Format for Data Exchange,\" Special Libraries,\n   vol. 59, pp 258-260, April 1968.\n\n\n\n\n\n\n\n\nMullery                                                         [Page 4]\n\f\nRFC 243          Network and Data Sharing Bibliography      October 1971\n\n\n   D. Karp and S. Seroussi, \"A Communication Interface for Computer\n   Networks,\" IBM Research Report No. RC3417, June 1971.\n\n   John L. Little, \"Some Evolving Conventions and Standards for\n   Character Information Code in Six, Seven, and Eight Bits,\" NBS\n   Technical Note 478, May 1969.\n\n   J. L. Little, C. N. Mooers, \"Standards for User Procedures and Data\n   Formats in Automated Information Systems and Networks,\" 1968 Spring\n   Joint Computer Conf., AFIPS Proc., vol 32, pp 89-94, 1968.\n\n   P. T. Wilkinson and R. A. Scantlebury, \"The Control Functions in a\n   Local Data Network,\"  Proc IFIP Congress 68, p. 734-738, August 1968.\n\n   NETWORK DESIGN\n\n   A. A. Benvenuto, et al., \"System Load Sharing Study,\" The MITRE\n   Corporation, Rept. MTB-5062, 1969.\n\n   E. K. Bowden, Sr., \"Priority Assignment in a Network of Computers,\"\n   IEEE Trans. Computers, vol. C-18 pp. 1021-1026, Nov. 1969.\n\n   P. R. Cox, \"General System Organisation of Multi-Processor\n   Configurations,\" Software 70, Sheffield England, p. 33-40, April\n   1970.\n\n   H. Frank, J. T. Frisch, and W. Chow, \"Topological Considerations in\n   the Design of the ARPA Network,\" 1970, Spring Joint Computer Conf.,\n   AFIPS Proc., vol. 36, p. 581-587, 1970.\n\n   D. Fredericksen and R. W. Ryniker, \"A Computer Network Interface for\n   OS/MVT,\" IBM Research Report RC3317, April 1971.\n\n   R. C. Gunderson and J. O. Johnson, \"Engineering Design and\n   Implementation of a Multi-Computer Data Processing System for a Navy\n   Command and Control Center,\" Proc. 7th International Convention on\n   Military Electronics, Western Periodicals, North Hollywood Calif.,\n   1968.\n\n   R. M. Hamaker, \"Distributed Computer Systems,\" Telecommunications,\n   vol. 4, p 25-30, March 1970.\n\n   F. Hansler, G. K. McAuliffe, R. S. Wilkov, \"Reliability\n   Considerations in Centralized Computer Networks,\" IBM Research Report\n   RC3354, May 1971.\n\n\n\n\n\n\nMullery                                                         [Page 5]\n\f\nRFC 243          Network and Data Sharing Bibliography      October 1971\n\n\n   W. G. Howe and T. R. Kibler, \"Control Concepts of Logical Network\n   Machine,\" IBM Research Report RC3331, April 1971.\n\n   L. Kleinrock, \"Analytic and Simulation Methods in Computer Network\n   Design,\" 1970 Spring Joint Computer Conf., AFIPS Proc., vol. 36, p.\n   569-579, 1970.\n\n   L. Kleinrock, \"Models for Computer Networks,\" Proc. IEEE. Conf. on\n   Commun., Session 21, p. 9-16, June 1969.\n\n   A. L. Leiner, W. A. Notz, J. L. Smith, and A. Weinberger, \"PILOT, A\n   New Multiple Computer System,\" J. ACM, vol 6, p. 315-335, July 1959.\n\n   D. B. McKay and D. P. Karp, \"Network/440 - - IBM Research Computer\n   Sciences Department Computer Network,\" IBM Research Report RC3431,\n   July 1971.\n\n   D. B. McKay and D. P. Karp, \"A Network/440 Protocol Concept,\" IBM\n   Research Report RC3432, July 1971.\n\n   D. B. McKay, D. P. Karp, J. W. Meyer, and R. S. Nachbar, \"Exploratory\n   Research on Netting at IBM,\" Research Report RC3486, June 1971.\n\n   \"An Experimental Computer Network,\" MIT Lexington, Rept. ESD-TR-69-\n   74, March 1969.\n\n   L. G. Roberts, and B. D. Wessler, \"Computer Network Development to\n   Achieve Resource Sharing,\" 1970 Spring Joint Computer Conf., AFIPS\n   Proc., vol. 36, p. 543-549, 1970.\n\n   J. J. Russell and D. C. Knight, \"Communication and Systems\n   Development in the C. S. T. R. O. (Commonwealth Scientific and\n   Industrial Research Organization) Network,\" Proc. 3rd Australian\n   Computer Conference, p. 384-386, 1966.\n\n   R. M. Rutldege, A. L. Vareha, L. C. Varian, A. H. Weis, S. F.\n   Seroussi, J. W. Meyer, J. F. Jaffee, and M. A. K. Angell, \"An\n   Interactive Network of Time-Sharing Computers,\" Proc. 24th National\n   Conference, A. C. M. Publication p-69, p. 431-442, 1969.\n\n   J. F. Sherlock, \"The Simulation of a Multi-Computer System,\" IEEE\n   Trans. Computers, vol C-19, pp. 1114-1117, Nov. 1970.\n\n   A. Shoshani and E. G. Coffman, \"Sequencing Tasks in Multi-Process,\n   Multiple Resource Systems to Avoid Deadlocks,\" Proc. 11th Annual\n   Symposium on Switching and Automata Theory, p. 225-233, Oct. 1970.\n\n\n\n\n\nMullery                                                         [Page 6]\n\f\nRFC 243          Network and Data Sharing Bibliography      October 1971\n\n\n   A. H. Weis, \"Distributed Network Activity at IBM,\" IBM Research\n   Report RC3392, June 1971.\n\n\n\n\n\n\n\n          [This RFC was put into machine readable form for entry]\n     [into the online RFC archives by Kelly Tardif, Viag\ufffdnie 10/1999]\n\n\n\n\n\n\n\n\n\n\n\n\n\n\n\n\n\n\n\n\n\n\n\n\n\n\n\n\n\n\n\n\n\n\n\n\n\n\n\n\nMullery                                                         [Page 7]\n\f\n"
}